{
  "allocation": {
    "entries": [
      {
        "chosen_by": "solver",
        "demand": "periph.uart",
        "locked_by": null,
        "pool": "mcu.uarts",
        "state": "sticky",
        "unit": 0
      }
    ],
    "lock_groups": [
      {
        "covers": [
          "pool_allocation",
          "pin_map"
        ],
        "name": "firmware-facing",
        "owner": "fw-team",
        "snapshot": null,
        "sync_point": "firmware-freeze",
        "version": 0
      }
    ],
    "solver_version": "ga019-trivial-1"
  },
  "bindings": {
    "mcu": "U1",
    "periph": "U2",
    "supply": "PS1"
  },
  "bound_parts": {
    "mcu": [
      {
        "chosen_by": "solver",
        "part": "MCU-3UART",
        "refdes": "U1"
      }
    ],
    "periph": [
      {
        "chosen_by": "solver",
        "part": "uart-peripheral",
        "refdes": "U2"
      }
    ],
    "supply": [
      {
        "chosen_by": "solver",
        "part": "SRC-3.3V",
        "refdes": "PS1"
      }
    ]
  },
  "connector_pinout": [],
  "series": "A",
  "solver_version": "ga019-trivial-1",
  "stamp": {
    "locks": {
      "firmware-facing": 0
    },
    "series": "A"
  },
  "wiring": [
    {
      "demand": "periph.uart",
      "net": "periph.uart.0.rx",
      "node": "U1.U0_RX",
      "pool": "mcu.uarts",
      "unit": 0
    }
  ]
}
